{
  "schema_version": "lathe.scene_graph.v1",
  "scene_id": "model_good_archive",
  "version": 1,
  "brief_id": "model_good_archive",
  "prompt": "A candlelit archive room with a warm scroll on a carved table.",
  "style_bible": {
    "mood": [
      "quiet",
      "antique"
    ],
    "palette": [
      "warm wood",
      "candle gold",
      "ink black"
    ],
    "materials": [
      "varnished wood",
      "aged paper",
      "wax"
    ],
    "forms": [
      "low arches",
      "carved table legs",
      "stacked books"
    ],
    "lighting": [
      "soft candle key",
      "dark room edges"
    ],
    "avoid": [
      "modern screens",
      "plastic furniture"
    ]
  },
  "layout": {
    "room_size": [
      6,
      5,
      3
    ],
    "main_path": {
      "from": "region_main_archive",
      "to": "obj_archive_table_001",
      "width": 1.1
    },
    "focal_point": "obj_archive_table_001",
    "density": "medium",
    "avoid_intersections": true
  },
  "regions": [
    {
      "region_id": "region_main_archive",
      "name": "Main Archive",
      "type": "interior",
      "purpose": "A compact room that frames the table as the first focal point.",
      "mood": "quiet and secretive",
      "bounds": {
        "center": [
          0,
          0,
          1.5
        ],
        "size": [
          6,
          5,
          3
        ]
      },
      "semantic_tags": [
        "archive",
        "interior"
      ]
    }
  ],
  "objects": [
    {
      "object_id": "obj_archive_table_001",
      "name": "Warm Archive Table",
      "role": "hero_prop",
      "region": "region_main_archive",
      "lathe_asset": "archive_table",
      "source_family": "carved_table",
      "transform": {
        "position": [
          0,
          0,
          0.7
        ],
        "rotation": [
          0,
          0,
          0
        ],
        "scale": [
          1,
          1,
          1
        ]
      },
      "material_bindings": [
        {
          "slot": "wood",
          "material": "mat_warm_wood"
        }
      ],
      "semantic_tags": [
        "archive",
        "interactive"
      ],
      "state": {
        "warm_scroll": true,
        "drawer": "closed"
      },
      "affordances": [
        {
          "id": "inspect_scroll",
          "action": "inspect",
          "reveals": "hidden_locked_map_truth"
        }
      ],
      "provenance": {
        "source": "deterministic_lathe",
        "commercial_use": true
      }
    }
  ],
  "relationships": [
    {
      "relationship_id": "rel_table_lit_by_candle",
      "from": "obj_archive_table_001",
      "to": "light_candle_key",
      "type": "lit_by",
      "description": "The table is the brightest readable object in the room."
    }
  ],
  "materials": [
    {
      "material_id": "mat_warm_wood",
      "name": "Warm Wood",
      "role": "hero_surface",
      "palette_refs": [
        "warm wood"
      ],
      "pbr": {
        "basecolor": "#6f4a2c",
        "roughness": 0.72
      }
    }
  ],
  "lights": [
    {
      "light_id": "light_candle_key",
      "type": "candle_cluster",
      "target": "obj_archive_table_001",
      "color": "candle gold",
      "intensity": 0.75,
      "purpose": "Readable warm key light on the table."
    }
  ],
  "cameras": [
    {
      "camera_id": "camera_reveal",
      "target": "obj_archive_table_001",
      "framing": "cinematic_wide",
      "purpose": "Show the table and surrounding archive shelves.",
      "fov_degrees": 48
    }
  ],
  "curiosity_anchors": [
    {
      "anchor_id": "curiosity_warm_scroll",
      "visible_clue": "The scroll is warmer than the candles nearby.",
      "hidden_fact": "The ink is responding to a locked map beneath the table.",
      "attached_to": "obj_archive_table_001",
      "suggested_user_actions": [
        "inspect scroll",
        "open drawer"
      ],
      "expansion_options": [
        {
          "id": "open_locked_map",
          "label": "Open the hidden map",
          "target_scope": "hidden_locked_map_truth",
          "required_assets": [
            "map_drawer",
            "inked_star_chart"
          ],
          "continuity_constraints": [
            "preserve table position",
            "preserve candle lighting"
          ]
        }
      ]
    }
  ],
  "hidden_state": [
    {
      "hidden_id": "hidden_locked_map_truth",
      "attached_to": "obj_archive_table_001",
      "fact": "A star map is sealed inside the table drawer.",
      "reveal_condition": "User inspects the warm scroll and opens the drawer.",
      "visible": false
    }
  ],
  "exports": [
    {
      "target": "glb",
      "format": "glb",
      "path": "exports/model_good_archive.glb",
      "metadata": {
        "object_ids_in_extras": true
      }
    }
  ],
  "build_artifacts": [],
  "memory_events": [
    {
      "event_id": "mem_initial_fact",
      "type": "fact",
      "text": "The archive table hides a warm map drawer.",
      "affected_ids": [
        "obj_archive_table_001"
      ],
      "source": "model_good_archive_scene_graph"
    }
  ]
}
